{
  "$schema": "./skills.schema.json",
  "schema_version": 1,
  "origins": [
    {
      "id": "myskills",
      "kind": "repository",
      "repository_url": "https://github.com/a0912129960/MySkills.git",
      "revision": null
    },
    {
      "id": "spec-package-generator",
      "kind": "repository",
      "repository_url": "https://github.com/a0912129960/spec-package-generator.git",
      "revision": "d56e1a9671b7fcf4927aaba4514e6620660922d3"
    },
    {
      "id": "mattpocock-skills",
      "kind": "repository",
      "repository_url": "https://github.com/a0912129960/mattpocock-skills.git",
      "revision": "ed37663cc5fbef691ddfecd080dff42f7e7e350d"
    },
    {
      "id": "obsidian-wiki",
      "kind": "repository",
      "repository_url": "https://github.com/a0912129960/obsidian-wiki.git",
      "revision": "1260c9f4aadfe5a216b109288cfb94f936719b8b"
    },
    {
      "id": "installed-standalone",
      "kind": "local-installation",
      "repository_url": null,
      "revision": null
    },
    {
      "id": "obsidian-skills",
      "kind": "repository",
      "repository_url": "https://github.com/a0912129960/obsidian-skills.git",
      "revision": "a1dc48e68138490d522c04cbf5822214c6eb1202"
    },
    {
      "id": "qmd",
      "kind": "repository",
      "repository_url": "https://github.com/a0912129960/qmd.git",
      "revision": "e428df76bc0274d9e93eb7ca3e95673315c42e90"
    }
  ],
  "summary": {
    "states": {
      "pending": 0,
      "managed": 42,
      "deferred": 0,
      "excluded": 50
    },
    "categories": {
      "engineering": 32,
      "productivity": 15,
      "personal": 0,
      "wiki": 38,
      "obsidian": 6,
      "qmd": 1
    }
  },
  "skills": [
    {"id": "myskills/ai-handoff", "source_name": "ai-handoff", "managed_name": "ai-handoff", "origin": "myskills", "source_path": "skills/productivity/ai-handoff", "category": "productivity", "state": "managed", "owner": "MySkills", "invocation": "explicit", "install_targets": ["codex", "claude-code", "antigravity-cli"]},
    {"id": "spec-package-generator/spec-package-generator", "source_name": "spec-package-generator", "managed_name": "spec-package-generator", "origin": "spec-package-generator", "source_path": "skills/spec-package-generator", "category": "engineering", "state": "managed", "owner": "MySkills", "invocation": "implicit", "install_targets": ["codex", "claude-code", "antigravity-cli"]},

    {"id": "mattpocock-skills/engineering/ask-matt", "source_name": "ask-matt", "managed_name": "ask-myskills", "origin": "mattpocock-skills", "source_path": "skills/engineering/ask-matt", "category": "engineering", "state": "managed", "owner": "MySkills", "invocation": "explicit", "install_targets": ["codex", "claude-code", "antigravity-cli"]},
    {"id": "mattpocock-skills/engineering/codebase-design", "source_name": "codebase-design", "managed_name": "codebase-design", "origin": "mattpocock-skills", "source_path": "skills/engineering/codebase-design", "category": "engineering", "state": "managed", "owner": "MySkills", "invocation": "implicit", "install_targets": ["codex", "claude-code", "antigravity-cli"]},
    {"id": "mattpocock-skills/engineering/code-review", "source_name": "code-review", "managed_name": "code-review", "origin": "mattpocock-skills", "source_path": "skills/engineering/code-review", "category": "engineering", "state": "managed", "owner": "MySkills", "invocation": "implicit", "install_targets": ["codex", "claude-code", "antigravity-cli"]},
    {"id": "mattpocock-skills/engineering/diagnosing-bugs", "source_name": "diagnosing-bugs", "managed_name": "diagnosing-bugs", "origin": "mattpocock-skills", "source_path": "skills/engineering/diagnosing-bugs", "category": "engineering", "state": "managed", "owner": "MySkills", "invocation": "implicit", "install_targets": ["codex", "claude-code", "antigravity-cli"]},
    {"id": "mattpocock-skills/engineering/domain-modeling", "source_name": "domain-modeling", "managed_name": "domain-modeling", "origin": "mattpocock-skills", "source_path": "skills/engineering/domain-modeling", "category": "engineering", "state": "managed", "owner": "MySkills", "invocation": "implicit", "install_targets": ["codex", "claude-code", "antigravity-cli"]},
    {"id": "mattpocock-skills/engineering/grill-with-docs", "source_name": "grill-with-docs", "managed_name": "grill-with-docs", "origin": "mattpocock-skills", "source_path": "skills/engineering/grill-with-docs", "category": "engineering", "state": "managed", "owner": "MySkills", "invocation": "explicit", "install_targets": ["codex", "claude-code", "antigravity-cli"]},
    {"id": "mattpocock-skills/engineering/implement", "source_name": "implement", "managed_name": "implement", "origin": "mattpocock-skills", "source_path": "skills/engineering/implement", "category": "engineering", "state": "managed", "owner": "MySkills", "invocation": "explicit", "install_targets": ["codex", "claude-code", "antigravity-cli"]},
    {"id": "mattpocock-skills/engineering/improve-codebase-architecture", "source_name": "improve-codebase-architecture", "managed_name": "improve-codebase-architecture", "origin": "mattpocock-skills", "source_path": "skills/engineering/improve-codebase-architecture", "category": "engineering", "state": "managed", "owner": "MySkills", "invocation": "explicit", "install_targets": ["codex", "claude-code", "antigravity-cli"]},
    {"id": "mattpocock-skills/engineering/prototype", "source_name": "prototype", "managed_name": "prototype", "origin": "mattpocock-skills", "source_path": "skills/engineering/prototype", "category": "engineering", "state": "managed", "owner": "MySkills", "invocation": "implicit", "install_targets": ["codex", "claude-code", "antigravity-cli"]},
    {"id": "mattpocock-skills/engineering/research", "source_name": "research", "managed_name": null, "origin": "mattpocock-skills", "source_path": "skills/engineering/research", "category": "engineering", "state": "excluded", "owner": null, "invocation": null, "install_targets": []},
    {"id": "mattpocock-skills/engineering/resolving-merge-conflicts", "source_name": "resolving-merge-conflicts", "managed_name": null, "origin": "mattpocock-skills", "source_path": "skills/engineering/resolving-merge-conflicts", "category": "engineering", "state": "excluded", "owner": null, "invocation": null, "install_targets": []},
    {"id": "mattpocock-skills/engineering/setup-matt-pocock-skills", "source_name": "setup-matt-pocock-skills", "managed_name": null, "origin": "mattpocock-skills", "source_path": "skills/engineering/setup-matt-pocock-skills", "category": "engineering", "state": "excluded", "owner": null, "invocation": null, "install_targets": []},
    {"id": "mattpocock-skills/engineering/tdd", "source_name": "tdd", "managed_name": "tdd", "origin": "mattpocock-skills", "source_path": "skills/engineering/tdd", "category": "engineering", "state": "managed", "owner": "MySkills", "invocation": "implicit", "install_targets": ["codex", "claude-code", "antigravity-cli"]},
    {"id": "mattpocock-skills/engineering/to-spec", "source_name": "to-spec", "managed_name": "to-spec", "origin": "mattpocock-skills", "source_path": "skills/engineering/to-spec", "category": "engineering", "state": "managed", "owner": "MySkills", "invocation": "explicit", "install_targets": ["codex", "claude-code", "antigravity-cli"]},
    {"id": "mattpocock-skills/engineering/to-tickets", "source_name": "to-tickets", "managed_name": null, "origin": "mattpocock-skills", "source_path": "skills/engineering/to-tickets", "category": "engineering", "state": "excluded", "owner": null, "invocation": null, "install_targets": []},
    {"id": "mattpocock-skills/engineering/triage", "source_name": "triage", "managed_name": null, "origin": "mattpocock-skills", "source_path": "skills/engineering/triage", "category": "engineering", "state": "excluded", "owner": null, "invocation": null, "install_targets": []},
    {"id": "mattpocock-skills/engineering/wayfinder", "source_name": "wayfinder", "managed_name": null, "origin": "mattpocock-skills", "source_path": "skills/engineering/wayfinder", "category": "engineering", "state": "excluded", "owner": null, "invocation": null, "install_targets": []},

    {"id": "mattpocock-skills/productivity/grilling", "source_name": "grilling", "managed_name": "grilling", "origin": "mattpocock-skills", "source_path": "skills/productivity/grilling", "category": "productivity", "state": "managed", "owner": "MySkills", "invocation": "implicit", "install_targets": ["codex", "claude-code", "antigravity-cli"]},
    {"id": "mattpocock-skills/productivity/grill-me", "source_name": "grill-me", "managed_name": "grill-me", "origin": "mattpocock-skills", "source_path": "skills/productivity/grill-me", "category": "productivity", "state": "managed", "owner": "MySkills", "invocation": "explicit", "install_targets": ["codex", "claude-code", "antigravity-cli"]},
    {"id": "mattpocock-skills/productivity/handoff", "source_name": "handoff", "managed_name": "session-checkpoint", "origin": "mattpocock-skills", "source_path": "skills/productivity/handoff", "category": "productivity", "state": "managed", "owner": "MySkills", "invocation": "explicit", "install_targets": ["codex", "claude-code", "antigravity-cli"]},
    {"id": "mattpocock-skills/productivity/teach", "source_name": "teach", "managed_name": null, "origin": "mattpocock-skills", "source_path": "skills/productivity/teach", "category": "productivity", "state": "excluded", "owner": null, "invocation": null, "install_targets": []},
    {"id": "mattpocock-skills/productivity/writing-great-skills", "source_name": "writing-great-skills", "managed_name": null, "origin": "mattpocock-skills", "source_path": "skills/productivity/writing-great-skills", "category": "productivity", "state": "excluded", "owner": null, "invocation": null, "install_targets": []},